{
    "$schema": "https://json-schema.org/draft/2020-12/schema",
    "$id": "https://github.com/espressif/openocd-esp32/blob/master/tcl/esp-config-schema.json",
    "title": "esp_config",
    "description": "esp_config",
    "type": "object",
    "properties": {
        "version": {
            "description": "Metadata file version",
            "type": "string"
        },
        "targets": {
            "description": "List of targets",
            "type": "array",
            "items": {
                "$ref": "#/definitions/targetsInfo"
            }
        },
        "interfaces": {
            "description": "List of debug interfaces",
            "type": "array",
            "items": {
                "$ref": "#/definitions/interfacesInfo"
            }
        },
        "boards": {
            "description": "List of boards",
            "type": "array",
            "items": {
                "$ref": "#/definitions/boardsInfo"
            }
        },
        "options": {
            "description": "List of options",
            "type": "array",
            "items": {
                "$ref": "#/definitions/optionsInfo"
            }
        },
        "openocd_feature_flags_ide": {
            "$ref": "#/definitions/featureFlagsIde"
        }
    },
    "required": [
        "version",
        "targets",
        "boards",
        "options"
    ],
    "definitions": {
        "targetsInfo": {
            "type": "object",
            "description": "Information about a target",
            "properties": {
                "id": {
                    "$ref": "#/definitions/chipID",
                    "description": "ID of the target e.g. 'esp32'"
                },
                "name": {
                    "description": "Name of the target e.g. 'ESP32'",
                    "type": "string"
                },
                "idcode": {
                    "description": "JTAG IDCODE of the chip",
                    "type": "string"
                },
                "ocdid": {
                    "description": "OCDID of Xtensa chip",
                    "type": "string"
                }
            },
            "required": [
                "id",
                "name"
            ]
        },
        "interfacesInfo": {
            "type": "object",
            "description": "Information about debug interface",
            "properties": {
                "id": {
                    "description": "Interface ID. Actually this is OpenOCD debug adapter driver name.",
                    "type": "string"
                },
                "config_file": {
                    "description": "Config file of debug interface e.g. 'ftdi/esp_ftdi.cfg'. Path relative to 'interface' sub-dir.",
                    "type": "string"
                },
                "command": {
                    "description": "Command for the debug interface driver, e.g. 'ftdi'",
                    "type": "string"
                }
            }
        },
        "boardsInfo": {
            "type": "object",
            "description": "Information about a board",
            "properties": {
                "name": {
                    "description": "Name of the board e.g. 'ESP-WROVER-KIT 1.8V'",
                    "type": "string"
                },
                "description": {
                    "description": "Description of the board e.g. 'ESP-WROVER-KIT with 1.8V ESP32-WROVER-B module'",
                    "type": "string"
                },
                "target": {
                    "description": "Target of the board e.g. 'esp32s2'",
                    "$ref": "#/definitions/chipID"
                },
                "config_files": {
                    "description": "Config Files of the board e.g. 'board/esp32-wrover-kit-1.8v.cfg'",
                    "type": "array",
                    "items": {
                        "type": "string"
                    }
                },
                "interface": {
                    "description": "Interface ID. Actually this is OpenOCD debug adapter driver name.",
                    "type": "string",
                    "$ref": "#/definitions/interfacesInfo/properties/id"
                },
                "location": {
                    "description": "Location of the board, e.g. for USB it will look like 'usb://<bus>-<port>[.<port>]...'.",
                    "type": "string"
                }
            },
            "required": [
                "name",
                "description",
                "target",
                "config_files"
            ]
        },
        "optionsInfo": {
            "type": "object",
            "description": "Information about options",
            "properties": {
                "name": {
                    "description": "Name of the option e.g. 'ESP_FLASH_VOLTAGE'",
                    "type": "string"
                },
                "values": {
                    "description": "Values of the option e.g. 'default', '1,8', 'auto'",
                    "type": "array",
                    "items": {
                        "type": "string"
                    }
                },
                "description": {
                    "description": "Description of the option e.g. 'Flash voltage', 'Flash size'",
                    "type": "string"
                },
                "type": {
                    "description": "Type of the option e.g. 'choice'",
                    "$ref": "#/definitions/optionTypes"
                },
                "targets": {
                    "description": "Targets for which the option is defined e.g. 'esp32', 'esp32s2'",
                    "type": "array",
                    "items": {
                        "$ref": "#/definitions/chipID"
                    }
                }
            },
            "required": [
                "name",
                "values",
                "description",
                "type"
            ]
        },
        "chipID": {
            "type": "string",
            "description": "Name of the chip target",
            "enum": [
                "esp32",
                "esp32s2",
                "esp32s3",
                "esp32c2",
                "esp32c3",
                "esp32c5",
                "esp32c6",
                "esp32c61",
                "esp32h2",
                "esp32h21",
                "esp32p4",
                "esp32h4",
                "esp32s31"
            ]
        },
        "optionTypes": {
            "type": "string",
            "description": "Option types",
            "enum": [
                "choice",
                "choice_edit"
            ]
        },
        "featureFlagsIde": {
            "description": "Defines the OpenOCD features available in this release impacting IDE integration (e.g. Espressif IDE or VSCode extension).",
            "type": "object",
            "properties": {
                "supports_new_port_syntax": {
                    "type": "boolean",
                    "description": "If true, IDEs should use 'gdb port' / 'telnet port' / 'tcl port' instead of legacy '*_port' options.",
                    "default": false
                }
            }
        }
    }
}