{
    "version": "1.0",
    "targets": [
        {
            "id": "esp32",
            "name": "ESP32",
            "idcode": "0x120034e5",
            "ocdid": "0x0733bff2"
        },
        {
            "id": "esp32s2",
            "name": "ESP32-S2",
            "idcode": "0x120034e5",
            "ocdid": "0x03339fd2"
        },
        {
            "id": "esp32s3",
            "name": "ESP32-S3",
            "idcode": "0x120034e5",
            "ocdid": "0x0b339fd2"
        },
        {
            "id": "esp32c2",
            "name": "ESP32-C2",
            "idcode": "0x0000cc25"
        },
        {
            "id": "esp32c3",
            "name": "ESP32-C3",
            "idcode": "0x00005c25"
        },
        {
            "id": "esp32c5",
            "name": "ESP32-C5",
            "idcode": "0x00017c25"
        },
        {
            "id": "esp32c6",
            "name": "ESP32-C6",
            "idcode": "0x0000dc25"
        },
        {
            "id": "esp32c61",
            "name": "ESP32-C61",
            "idcode": "0x00014c25"
        },
        {
            "id": "esp32h2",
            "name": "ESP32-H2",
            "idcode": "0x00010c25"
        },
        {
            "id": "esp32h21",
            "name": "ESP32-H21",
            "idcode": "0x00019c25"
        },
        {
            "id": "esp32p4",
            "name": "ESP32-P4",
            "idcode": "0x00012c25"
        },
        {
            "id": "esp32h4",
            "name": "ESP32-H4",
            "idcode": "0x0001cc25"
        },
        {
            "id": "esp32s31",
            "name": "ESP32-S31",
            "idcode": "0x00020C25"
        }
    ],
    "interfaces": [
        {
            "id": "ftdi",
            "config_file": "ftdi/esp_ftdi.cfg",
            "command": "ftdi"
        },
        {
            "id": "esp_usb_jtag",
            "config_file": "esp_usb_jtag.cfg",
            "command": "espusbjtag"
        },
        {
            "id": "esp_usb_bridge",
            "config_file": "esp_usb_bridge.cfg",
            "command": "espusbjtag"
        }
    ],
    "boards": [
        {
            "name": "ESP-WROVER-KIT 3.3V",
            "description": "ESP-WROVER-KIT with 3.3V ESP32-WROVER-B module",
            "target": "esp32",
            "interface": "ftdi",
            "config_files": [
                "board/esp32-wrover-kit-3.3v.cfg"
            ]
        },
        {
            "name": "ESP-WROVER-KIT 1.8V",
            "description": "ESP-WROVER-KIT with 1.8V ESP32-WROVER-B module",
            "target": "esp32",
            "interface": "ftdi",
            "config_files": [
                "board/esp32-wrover-kit-1.8v.cfg"
            ]
        },
        {
            "name": "ESP32-ETHERNET-KIT",
            "description": "ESP32-ETHERNET-KIT with ESP32-WROVER-E module",
            "target": "esp32",
            "interface": "ftdi",
            "config_files": [
                "board/esp32-ethernet-kit-3.3v.cfg"
            ]
        },
        {
            "name": "ESP32 chip (via ESP-PROG)",
            "description": "ESP32 debugging via ESP-PROG board",
            "target": "esp32",
            "interface": "ftdi",
            "config_files": [
                "interface/ftdi/esp_ftdi.cfg",
                "target/esp32.cfg"
            ]
        },
        {
            "name": "ESP32 chip (via ESP-PROG-2)",
            "description": "ESP32 debugging via ESP-PROG-2 board",
            "target": "esp32",
            "interface": "esp_usb_bridge",
            "config_files": [
                "board/esp32-bridge.cfg"
            ]
        },
        {
            "name": "ESP32-SOLO-1 module (via ESP-PROG)",
            "description": "ESP32-SOLO-1 debugging via ESP-PROG board",
            "target": "esp32",
            "interface": "ftdi",
            "config_files": [
                "interface/ftdi/esp_ftdi.cfg",
                "target/esp32-solo-1.cfg"
            ]
        },
        {
            "name": "ESP32-S2-KALUGA-1",
            "description": "ESP32-S2-KALUGA-1 kit",
            "target": "esp32s2",
            "interface": "ftdi",
            "config_files": [
                "board/esp32s2-kaluga-1.cfg"
            ]
        },
        {
            "name": "ESP32-S2 chip (via ESP-PROG)",
            "description": "ESP32-S2 debugging via ESP-PROG board",
            "target": "esp32s2",
            "interface": "ftdi",
            "config_files": [
                "interface/ftdi/esp_ftdi.cfg",
                "target/esp32s2.cfg"
            ]
        },
        {
            "name": "ESP32-S2 chip (via ESP-PROG-2)",
            "description": "ESP32-S2 debugging via ESP-PROG-2 board",
            "target": "esp32s2",
            "interface": "esp_usb_bridge",
            "config_files": [
                "board/esp32s2-bridge.cfg"
            ]
        },
        {
            "name": "ESP32-S3 chip (via builtin USB-JTAG)",
            "description": "ESP32-S3 debugging via builtin USB-JTAG",
            "target": "esp32s3",
            "interface": "esp_usb_jtag",
            "config_files": [
                "board/esp32s3-builtin.cfg"
            ]
        },
        {
            "name": "ESP32-S3 chip (via ESP-PROG)",
            "description": "ESP32-S3 debugging via ESP-PROG board",
            "target": "esp32s3",
            "interface": "ftdi",
            "config_files": [
                "interface/ftdi/esp_ftdi.cfg",
                "target/esp32s3.cfg"
            ]
        },
        {
            "name": "ESP32-S3 chip (via ESP-PROG-2)",
            "description": "ESP32-S3 debugging via ESP-PROG-2 board",
            "target": "esp32s3",
            "interface": "esp_usb_bridge",
            "config_files": [
                "board/esp32s3-bridge.cfg"
            ]
        },
        {
            "name": "ESP32-C2 chip (via ESP-PROG)",
            "description": "ESP32-C2 debugging via ESP-PROG board",
            "target": "esp32c2",
            "interface": "ftdi",
            "config_files": [
                "board/esp32c2-ftdi.cfg"
            ]
        },
        {
            "name": "ESP32-C2 chip (via ESP-PROG-2)",
            "description": "ESP32-C2 debugging via ESP-PROG-2 board",
            "target": "esp32c2",
            "interface": "esp_usb_bridge",
            "config_files": [
                "board/esp32c2-bridge.cfg"
            ]
        },
        {
            "name": "ESP32-C3 chip (via builtin USB-JTAG)",
            "description": "ESP32-C3 debugging via builtin USB-JTAG",
            "target": "esp32c3",
            "interface": "esp_usb_jtag",
            "config_files": [
                "board/esp32c3-builtin.cfg"
            ]
        },
        {
            "name": "ESP32-C3 chip (via ESP-PROG)",
            "description": "ESP32-C3 debugging via ESP-PROG board",
            "target": "esp32c3",
            "interface": "ftdi",
            "config_files": [
                "board/esp32c3-ftdi.cfg"
            ]
        },
        {
            "name": "ESP32-C3 chip (via ESP-PROG-2)",
            "description": "ESP32-C3 debugging via ESP-PROG-2 board",
            "target": "esp32c3",
            "interface": "esp_usb_bridge",
            "config_files": [
                "board/esp32c3-bridge.cfg"
            ]
        },
        {
            "name": "ESP32-C5 chip (via builtin USB-JTAG)",
            "description": "ESP32-C5 debugging via builtin USB-JTAG",
            "target": "esp32c5",
            "interface": "esp_usb_jtag",
            "config_files": [
                "board/esp32c5-builtin.cfg"
            ]
        },
        {
            "name": "ESP32-C5 chip (via ESP-PROG)",
            "description": "ESP32-C5 debugging via ESP-PROG board",
            "target": "esp32c5",
            "interface": "ftdi",
            "config_files": [
                "board/esp32c5-ftdi.cfg"
            ]
        },
        {
            "name": "ESP32-C5 chip (via ESP-PROG-2)",
            "description": "ESP32-C5 debugging via ESP-PROG-2 board",
            "target": "esp32c5",
            "interface": "esp_usb_bridge",
            "config_files": [
                "board/esp32c5-bridge.cfg"
            ]
        },
        {
            "name": "ESP32-C5 chip with LP core (via builtin USB-JTAG)",
            "description": "ESP32-C5 with LP core debugging via builtin USB-JTAG",
            "target": "esp32c5",
            "interface": "esp_usb_jtag",
            "config_files": [
                "board/esp32c5-lpcore-builtin.cfg"
            ]
        },
        {
            "name": "ESP32-C5 chip with LP core (via ESP-PROG)",
            "description": "ESP32-C5 with LP core debugging via ESP-PROG board",
            "target": "esp32c5",
            "interface": "ftdi",
            "config_files": [
                "board/esp32c5-lpcore-ftdi.cfg"
            ]
        },
        {
            "name": "ESP32-C5 chip with LP core (via ESP-PROG-2)",
            "description": "ESP32-C5 with LP core debugging via ESP-PROG-2 board",
            "target": "esp32c5",
            "interface": "esp_usb_bridge",
            "config_files": [
                "board/esp32c5-lpcore-bridge.cfg"
            ]
        },
        {
            "name": "ESP32-C6 chip (via builtin USB-JTAG)",
            "description": "ESP32-C6 debugging via builtin USB-JTAG",
            "target": "esp32c6",
            "interface": "esp_usb_jtag",
            "config_files": [
                "board/esp32c6-builtin.cfg"
            ]
        },
        {
            "name": "ESP32-C6 chip (via ESP-PROG)",
            "description": "ESP32-C6 debugging via ESP-PROG board",
            "target": "esp32c6",
            "interface": "ftdi",
            "config_files": [
                "board/esp32c6-ftdi.cfg"
            ]
        },
        {
            "name": "ESP32-C6 chip (via ESP-PROG-2)",